idProperty,Description
QIAN880135,"D Weights for coil at the window position of 2 (Qian-Sejnowski, 1988)"
QIAN880134,"D Weights for coil at the window position of 1 (Qian-Sejnowski, 1988)"
GUYH850101,"D Partition energy (Guy, 1985)"
NAGK730101,"D Normalized frequency of alpha-helix (Nagano, 1973)"
GRAR740101,"D Composition (Grantham, 1974)"
GEOR030109,D Linker propensity from non-helical (annotated by DSSP) dataset
SNEP660103,"D Principal component III (Sneath, 1966)"
NAKH900102,"D SD of AA composition of total proteins (Nakashima et al., 1990)"
AURR980117,"D Normalized positional residue frequency at helix termini C' (Aurora-Rose,"
PALJ810103,"D Normalized frequency of beta-sheet from LG (Palau et al., 1981)"
CHAM810101,"D Steric parameter (Charton, 1981)"
QIAN880121,"D Weights for beta-sheet at the window position of 1 (Qian-Sejnowski, 1988)"
LEVM760107,"D van der Waals parameter epsilon (Levitt, 1976)"
GEIM800101,"D Alpha-helix indices (Geisow-Roberts, 1980)"
SUEM840101,"D Zimm-Bragg parameter s at 20 C (Sueki et al., 1984)"
PRAM900102,"D Relative frequency in alpha-helix (Prabhakaran, 1990)"
QIAN880122,"D Weights for beta-sheet at the window position of 2 (Qian-Sejnowski, 1988)"
RICJ880104,"D Relative preference value at N1 (Richardson-Richardson, 1988)"
LEVM780104,"D Normalized frequency of alpha-helix, unweighted (Levitt, 1978)"
LEVM780105,"D Normalized frequency of beta-sheet, unweighted (Levitt, 1978)"
FAUJ880110,"D Number of full nonbonding orbitals (Fauchere et al., 1988)"
MONM990101,"D Turn propensity scale for transmembrane helices (Monne et al., 1999)"
CRAJ730103,"D Normalized frequency of turn (Crawford et al., 1973)"
KANM800104,"D Average relative probability of inner beta-sheet (Kanehisa-Tsong, 1980)"
COWR900101,"D Hydrophobicity index, 3.0 pH (Cowan-Whittaker, 1990)"
KIMC930101,"D Thermodynamic beta sheet propensity (Kim-Berg, 1993)"
QIAN880118,"D Weights for beta-sheet at the window position of -2 (Qian-Sejnowski, 1988)"
FUKS010109,D Entire chain composition of amino acids in intracellular proteins of
MCMT640101,"D Refractivity (McMeekin et al., 1964), Cited by Jones (1975)"
